{
    "page_keys": ["subject", "acquisition", "reconstruction", "run", "session"],
    "page_filename_template": "sub-{subject}[/ses-{session}]/sub-{subject}[_ses-{session}][_acq-{acquisition}][_rec-{reconstruction}][_run-{run}]_QC.html",
    "index_filename": "QC_index.html",
    "patterns": {
        "simple": "(?P<base>.*)\\.(?P<extension>.*)",
        "crash": "sub-(?P<subject>[a-zA-Z0-9]+)(/ses-(?P<session>[a-zA-Z0-9]+))?/logs/sub-(?P=subject)(_ses-(?P=session))?(_acq-(?P<acquisition>[a-zA-Z0-9]+))?(_rec-(?P<reconstruction>[a-zA-Z0-9]+))?(_run-(?P<run>[0-9]+))?/crash.*\\.pklz",
	"bids": [
	    "bids",
	    "derivatives", 
	    {
		"name": "pndni_bids",
		"entities": [
		    {
			"name": "skullstripped",
			"pattern": "[_/\\\\]+skullstripped-([a-zA-Z0-9]+)"
		    },
		    {
			"name": "map",
			"pattern": "[_/\\\\]+map-([a-zA-Z0-9]+)"
		    },
		    {
			"name": "presuffix",
			"pattern": "_([a-zA-Z0-9]*?)_[a-zA-Z0-9]*?\\.[^/\\\\]+$"
		    }
		]
	    }
	]
    },
    "files": {
        "model": {
            "pattern": "simple",
            "filter": {"base": "model"},
            "global": true
        },
        "T1w": {
            "pattern": "bids",
            "filter": {"suffix": "T1w", "space": null, "desc": null}
        },
        "nu_bet": {
            "pattern": "bids",
            "filter": {"desc": "nucor"}
        },
        "normalized": {
            "pattern": "bids",
            "filter": {"desc": "normalized"}
        },
        "warped_model": {
            "pattern": "bids",
            "filter": {"space": "T1w", "suffix": "T1w"}
        },
        "features": {
            "pattern": "bids",
            "filter": {"suffix": "features", "extension": "txt"}
        },
        "features_label": {
            "pattern": "bids",
            "filter": {"presuffix": "features", "suffix": "labels", "extension": "tsv"}
        },
        "classified": {
            "pattern": "bids",
            "filter": {"suffix": "dseg", "desc": "tissue"}
        },
        "transformed_atlas": {
            "pattern": "bids",
            "filter": {"suffix": "dseg", "desc": "lobes"}
        },
        "crashfiles": {
            "pattern": "crash",
            "filter": {},
            "allow_multiple": true
        }
    },
    "reportlets": [
    ]
}
